product_name,opinion_id,sentiment,opinion,date
Balatro,207956089,negative,"When I started playing Balatro I was presented with the choice of playing a poker-like hand or exchanging cards. Trying to figure out how to balance these could be a fun learning curve. Looking at a screen full of numbers I tried mousing over them to see if there was a tool tip explaining when they meant or maybe some in-game help. No such luck. Playing hands blindly for a while I eventually ""won""? I was presented with a screen with an option to ""cash out"". Actually there was no other option. So cashing out is a good thing? Not sure. Next I'm presented with a joker that changes the rules of the game in many different ways, and a different joker-like card that is not a joker that also changes the rules of the game in many ways, and a store where I can buy cards for cash including, for my sins, a loot box. Then I'm presented with three different game modes with no explanation of why I would want to play one over the other. That is a lot of complexity to dump on the player all at once.  Lacking any help or more tutorials I wade into the game without understanding. I play some hands. Some numbers go up. Others go down. I'm not really sure what I should pay attention to. After a while it dawns on me. I have no idea what the goal is. Trying to figure out the byzantine rules and how they combine is slightly fun, but I have no sense of progress and no sense of purpose. The only thing I can tell for sure is when I win a round  I assume eventually I'll reach some sort of major win state, but frankly I lack the patience for it.  This might be a good game, but it needs more comprehensive tutorials and/or in-game help system to help players up the learning curve.",2025-10-30
Balatro,207920804,negative,"it's a very hard title to really put a thumb on...  At the very core of the game play, this is nearly perfect and too naked at the same time that Balatro felt so brutally straightforward.   It is almost hypocritical to say that you actually miss some extra fluff eg: more animation/mini-games because the game was designed so that you would just get right into it without having to deal with anything else but the bulk of the gameplay which is the strategy, yet, because you literally just grind it out the minute you boot the game up made it felt so much like your 9-5 job that I just can't continue play for too long each session.  ",2025-10-30
Balatro,207849018,negative,Number go up,2025-10-29
Balatro,207736331,negative,bad game,2025-10-27
Balatro,207720136,negative,Much like my issues with Cloverpit and other luck based games it stops being fun when the game stops allowing you to win. In Cloverpit I gave up after 65 losses in a row. Here it took less because the frustration points are more egregious. Delay between selecting things and the game actually allowing you to play have given me more than enough time to say: I don't recommend this game. I will actively tell people to avoid this game. I actually hope that people making games like this lose their jobs.,2025-10-27
Balatro,207688386,negative,"It's fun on the first set of difficulties, but eventually it just becomes a tedious exercise of what feels like the game developers actively taunting you with how close you get to the next band before rug-pulling.  Eventually EVERYTHING hinges on you being just lucky enough with just the right set of jokers at just the right stages and it just stops being fun. Especially when what counts for the conditions of a card, i.e. what is considered an enhanced card, seems horribly arbitrary.  Furthermore - the conditions that cause deterioration are badly designed - losing points on Ramen, a multiplying joker that loses .01 of its multiplyer per card discarded, when the Boss Blind is Hook, a joker that discards 2 per hand played - this is ridiculous! The Arm, which takes away a level of a hand played - an utterly unfair Boss Blind that just makes your efforts feel wasted.   The Wall and later Violet Vessel, especially on higher difficulties, are just cruel. Especially as the cards which have a 1 in however much chance of popping clearly don't work properly and need to be fixed. Even when you have the joker which doubles their chances of activating they don't work unless the base chance is a 1 in 2.  I want to like this game, but there are so many aspects that just make me go to the devs ""what do you expect me to do when I'm not being given anything to work with?""",2025-10-27
Balatro,207684461,negative,the evil clown was mean to me whenever i lost a bind :(,2025-10-27
Balatro,207617654,negative,FUCK YOU,2025-10-26
Balatro,207593453,negative,Game used to work on Linux but doesn't after update.,2025-10-25
Balatro,207418287,negative,Umamusume is better,2025-10-23
Balatro,207407023,negative,"I miss when roguelikes weren't just bureaucracy. I'm a number cruncher ""playing"" poker and throwing random crap on the table.",2025-10-23
Balatro,207356625,negative,it's good but it won't give me my last two achievements for gold staking every deck and joker,2025-10-23
Balatro,207335690,negative,"Cant kill jimbo, 0/10",2025-10-22
Balatro,207273387,negative,The game is really easy and offers not much challenge until you start stacking stakes and at that point you start to just gamble for wins.,2025-10-21
Balatro,207223640,negative,no pg 13 bad :( was scarred of gambling,2025-10-21
Balatro,207216472,negative,has ruined my life,2025-10-21
Balatro,207208310,negative,absolute boring game for gambling addicts have no idea why it was even nominated for game of the year,2025-10-21
Balatro,207200026,negative,"Idek how tf people actually understand ts, all luck",2025-10-20
Balatro,207146984,negative,hyped for nothing,2025-10-20
Balatro,207113721,negative,this game is dookie poopie,2025-10-19
Balatro,207065194,negative,rng,2025-10-19
Balatro,207047451,negative,bloodstone,2025-10-18
Balatro,207041000,negative,Shit,2025-10-18
Balatro,207031935,negative,"Clickbaited, no Jimbo sucking on a banana in the game don't buy it",2025-10-18
Balatro,206986899,negative,"Really fun at low stakes while you're still figuring out how to combine different jokers and cards and unlocking stuff, but then turns into a tedious unfun RNG-fest where you can lose a hundred or so runs in a row just to things entirely out of your control and essentially waste hours of your life which could be spent on something much more productive. Recommend playing until somewhere around Purple stake, after that - either prepare for a boring RNG-slog or go find something more fun to do.",2025-10-18
Balatro,206961303,negative,top 5 most overglazed games ever bro this is so boring,2025-10-17
Balatro,206896155,negative,"FUCK VIOLEY VESSELK ",2025-10-17
Balatro,206883419,negative,"I tried to like this game but honestly it's really annoying with all the ""gotcha"" mechanics they have. Like I don't mind games with luck or variance but this game targets your lack of experience once you develop a feel for how the game is supposed to work.   I've lost to a final boss a few times because  1. They didn't mention wild cards count for debuff blinds  2. That a joker that copies the properties of another one based on position will be deactivated too on a boss blind that disables jokers (which is partially my fault but the annoying thing is they don't tell you that joker order matters and that you can move jokers whenever)  3. The most common, the game picks a boss blind that just shits on your current deck. Like there's an element of randomness but whenever I test a build (for instance going for flushes) the same boss blind comes up over and over again (disable a key suit or unique hands only)  Like I get the appeal of finding synergies and feeling like you busted the game, that parts fun, but the targeted RNG makes it more frustrating than it's worth because once you get the basics (EV, the difference between additive multiplication and true multiplication, the algebra equation that the jokers are) it's a 40 minute minefield of what you don't know and the only lesson I learn is watch out for that particular mechanic next time.",2025-10-16
Balatro,206875469,negative,"I wish there was a way to write a review without having to recommend it or not. If you love card games and poker and want to play them on a computer, you might love this game. I was hoping that this would be more than that, based on the hype around it, but after playing it, that's pretty much all it was to me. Yes, you can get multiplier cards and things to build your deck, but it was still just a card game at the end of the day. I don't understand what people find so addicting about it or anything. It ended up being as boring as it looked to me.",2025-10-16
Balatro,206853981,negative,nej,2025-10-16
Balatro,206816775,negative,no,2025-10-15
Balatro,206764320,negative,I forgot to eat the entire day because of this game... Not the healthiest game to have in your library.,2025-10-15
Balatro,206538404,negative,Beyond unplayable. Half the games just disable more than half your cards. The joker effects are not always applied.,2025-10-12
Balatro,206480603,negative,game changes screen brightness on exit,2025-10-11
Balatro,206387450,negative,-,2025-10-10
Balatro,206313457,negative,"I LOVE THIS GAME, COOL MECHANICS, GREAT COLLECTABLE SYSTEM, CHALLENGING.",2025-10-10
Balatro,206120026,negative,"couldn't win a single run for 10 hours then game solved it self with randomness and i got achievement 100,000K for scoring 100 000 000 in a single hand that only 22.6% of players have. game is a random garbage that make fun of you every time you loose and doesn't give enough information for what you did wrong. i miss the time when games were fun from the beginning and didn't require you to spend 10s of hours just to reach skill floor",2025-10-07
Balatro,206091730,negative,play poker hands like in poker but it's not poker it's solitaire,2025-10-07
Balatro,206034024,negative,"I understand the appeal. I like deck builders. I like number go up.  I don't like poker in particular and I don't really like the lack of any reason or story.  It's just play poker and break the rules.  And for some?  That's enough.  That'll get the good brain chemicals for a lot of people.  But after a bit over a day's worth of hours plugged into it I kinda just... felt a bit empty.  Doing it purely for the sake of doing it.  I wouldn't have honestly picked up this game at all but it was gifted to me so I felt compelled to give it a fair shake.  It ain't for me, but I've never had much of a poker face anyway.",2025-10-06
Balatro,206029077,negative,too hard,2025-10-06
Balatro,205850743,negative,Fun at the very beginning or at low stakes Turns into extreme grind and constant restarts at 2-3 ante on orange/gold stakes,2025-10-04
Balatro,205819755,negative,white people the moment balatro stops being unfunny,2025-10-04
Balatro,205796051,negative,this game is so white and unfunny,2025-10-03
Balatro,205792301,negative,fucking game,2025-10-03
Balatro,205733927,negative,game wont even launch without breaking,2025-10-03
Balatro,205724863,negative,BALALA,2025-10-02
Balatro,205717821,negative,Wlle the the ing is that the game it actually is bad because tjat photochad isnt good enough.,2025-10-02
Balatro,205597422,negative,No,2025-10-01
Balatro,205588393,negative,i never knew how much time could spent making poker hands instead of talking to my wife,2025-10-01
Balatro,205510527,negative,Its TO addicting,2025-09-30
Balatro,205496606,negative,great game but it went on sale the day after i bought it,2025-09-29
Balatro,205432233,negative,"Love the game, but the experience is ruined when I try to mute or adjust the audio with my keyboard which causes not just the game but my entire desktop computer to crash.  Stick with the console versions.",2025-09-28
Balatro,205429931,negative,"I got brain cancer ",2025-09-28
Balatro,205351807,negative,"Too lucked based, might as well play coin-flip simulator.",2025-09-27
Balatro,205297459,negative,trash,2025-09-27
Balatro,205286470,negative,"When I first wrote my review for this game, I complained that you should only buy it if you enjoy gambling already. I want to take that back, but what I won't take back is that I still don't find this game fun. For the majority of my playtime, I was unable to win a single game, but that was because I was using my brain too much. Now that I know how to win, I'm going to explain why I still don't enjoy this game.  The way to win in this game is to spam the same hand over and over and over again. The part where you actually play the game is the part you shouldn't be thinking about at all because you just need to play the same hand you did before. The only part you need to actually think about what hand to play is the very beginning of the game, which is as close to true Poker as Balatro gets. The part of the game where your sense of strategy even matters is in the shop, which I frankly don't find very fun. The shop isn't just where you ""improve your run,"" the shop is so crucial and integral to the flow of this game that you will spend more time there than actually playing with the cards that you'll be buying. It doesn't feel rewarding, it only feels stressful. The game constantly makes you worry about what you should and shouldn't buy, because if you buy what the game deems as ""the wrong thing,"" it can kill your run rounds before you even realize it.  Losing to what feels like one mistake is soul-crushing, and it doesn't give me this yearning to play the game ""one more time."" I just end up feeling defeated, and want to play something else.",2025-09-27
