product_name,opinion_id,sentiment,opinion,score,date
The Great Gatsby,172,negative,"The book was slow, and I couldn’t empathize with any of the characters. I didn’t find it engaging.",2,2025-11-26
The Great Gatsby,173,positive,A beautiful exploration of the pursuit of wealth and love. Fitzgerald’s prose is poetic and evocative.,5,2025-11-26
The Great Gatsby,174,negative,"The story didn’t capture my attention, and the characters didn’t resonate with me at all.",2,2025-11-26
The Great Gatsby,175,positive,A masterpiece. Fitzgerald’s depiction of the Jazz Age and the failure of the American Dream is both heartbreaking and insightful.,5,2025-11-26
The Great Gatsby,176,negative,"I didn’t like the characters, and the plot was too slow for my taste. I couldn’t get into the story.",1,2025-11-26
The Great Gatsby,177,positive,"An exquisite portrayal of longing, wealth, and loss. Fitzgerald’s writing is poetic and compelling.",5,2025-11-26
The Great Gatsby,178,negative,"I didn’t find this book engaging at all. The pacing was slow, and I couldn’t connect with any of the characters.",1,2025-11-26
The Great Gatsby,179,positive,"Fitzgerald’s storytelling is impeccable. A beautifully tragic tale about love, hope, and loss.",5,2025-11-26
The Great Gatsby,180,negative,"The plot felt repetitive, and the characters were unappealing to me. I couldn’t finish it.",1,2025-11-26
The Great Gatsby,181,positive,A powerful and haunting story about the fragility of the American Dream. Fitzgerald’s writing is exceptional.,5,2025-11-26
The Great Gatsby,182,negative,"The book didn’t captivate me. The characters were shallow, and the story didn’t engage me.",2,2025-11-26
The Great Gatsby,183,positive,"An unforgettable novel about hope, loss, and the American Dream. Fitzgerald’s writing is breathtaking.",5,2025-11-26
The Great Gatsby,184,negative,"The writing didn’t work for me, and I found it hard to care about the characters. I didn’t enjoy the story.",2,2025-11-26
The Great Gatsby,185,positive,A beautifully tragic and insightful story about the consequences of chasing false dreams. Fitzgerald’s writing is exquisite.,5,2025-11-26
The Great Gatsby,186,negative,I couldn’t connect with the characters or the story. The book felt very slow and hard to follow.,1,2025-11-26
The Great Gatsby,187,positive,"A profound and timeless story. Fitzgerald’s prose is flawless, and the story will stay with me forever.",5,2025-11-26
The Great Gatsby,188,negative,"I didn’t care for the characters, and the story didn’t engage me. I found the pacing too slow.",2,2025-11-26
The Great Gatsby,189,positive,A stunning exploration of ambition and love. Fitzgerald captures the emptiness of the American Dream perfectly.,5,2025-11-26
The Great Gatsby,190,negative,"I couldn’t finish the book. The characters didn’t feel real, and the story was hard to get into.",1,2025-11-26
The Great Gatsby,191,positive,"Fitzgerald’s depiction of the Jazz Age is exceptional. The themes of love, wealth, and tragedy are still relevant today.",5,2025-11-26
The Great Gatsby,192,negative,"The writing was too slow for me, and I couldn’t connect with any of the characters. I didn’t enjoy it.",2,2025-11-26
The Great Gatsby,193,positive,"A beautifully written story about love, obsession, and the American Dream. Fitzgerald’s prose is lyrical.",5,2025-11-26
The Great Gatsby,194,negative,"The story didn’t live up to the hype. I didn’t like the characters, and the plot was too slow for me.",2,2025-11-26
The Great Gatsby,195,positive,"A stunning, tragic tale that captures the dreams and disillusionments of an entire era. Fitzgerald’s writing is top-notch.",5,2025-11-26
The Great Gatsby,196,negative,"I couldn’t finish it. The book was too slow, and the characters were unlikable.",1,2025-11-26
The Great Gatsby,197,positive,A timeless tale about the fragility of dreams and the excesses of the Jazz Age. Fitzgerald’s writing is flawless.,5,2025-11-26
The Great Gatsby,198,negative,"The book didn’t grab me. The characters were shallow, and the plot felt aimless.",2,2025-11-26
The Great Gatsby,199,positive,An unforgettable classic. Fitzgerald’s poetic style and exploration of love and ambition make this a must-read.,5,2025-11-26
The Great Gatsby,200,negative,"I found the book tedious and boring. The characters were uninteresting, and the pacing was slow.",1,2025-11-26
